{
  "brand": "Leo Forge\u2122",
  "legalEntity": "Leo Forge Studios LLC",
  "founder": "LaRoy Stewart",
  "founderAttribution": "Founded by LaRoy Stewart",
  "tagline": "Create. Protect. Elevate.",
  "website": "https://www.leoforgestudios.com",
  "contactEmail": "contact@leoforgestudios.com",
  "publicGitHubOrganization": "",
  "updatedAt": "2026-08-01"
}
